{
  "schemaVersion": "1.0",
  "kind": "visual-semantic-projection-request",
  "requestId": "junior-readable-measurement-semantic-projection",
  "subjectPack": "junior-physics-answer",
  "fixtureKind": "synthetic_fixture",
  "dataClassification": {
    "level": "public",
    "notes": "Fully synthetic public semantic projection; no teacher, student, or exam data."
  },
  "semanticDeclaration": {
    "artifactRef": "eval/visual-semantic-projection/cases/junior-readable-measurement.visual-synthetic-semantic-declaration.json",
    "rawByteSha256": "3f50ae04ff2c502d5ca851168ebaf8a9f208063efbf71e63ca7a09058d71bc9d",
    "declarationId": "junior-readable-measurement-semantic-declaration"
  },
  "ocrDiagnosticReport": {
    "artifactRef": "eval/visual-ocr-diagnostics/cases/visual-ocr-diagnostic-report.json",
    "rawByteSha256": "373be1301b61a0ef3fb10976bdab9bf131bdd8d01551a5562fbb1975e4b00a69"
  },
  "textRegionDiagnosticReport": {
    "artifactRef": "eval/visual-text-region-diagnostics/cases/visual-text-region-diagnostic-report.json",
    "rawByteSha256": "a1e73dc4370f189f5c0044ab420614289531531c633f555b09ef7f66893e71d7"
  },
  "associationResult": {
    "artifactRef": "eval/visual-ocr-region-association/cases/junior-readable-measurement.visual-ocr-region-association-result.json",
    "rawByteSha256": "016116b9964e31e412bb40b2ec789a047e42dac7289814925b6e54254370b799",
    "requestId": "junior-readable-measurement"
  },
  "ocrObservationResult": {
    "artifactRef": "eval/visual-ocr-observation/cases/junior-readable-measurement.visual-ocr-observation-result.json",
    "rawByteSha256": "17aa31f7fa71bae34c0c72213b6557546c43b3c038daa1f209743bf67d15c532",
    "requestId": "junior-readable-measurement"
  },
  "crop": {
    "artifactRef": "junior-readable-measurement.crop-2x.png",
    "scale": 2,
    "rawByteSha256": "619e236453646fdb4dfb772b3e8ead65e0597c6118af089f731a57cd57633aa6",
    "decodedRgbPixelSha256": "ac5f2a7abd8ad3aeb98c83ce2db7f9cf2d02b1b7cd357aba0c8323b94b1b01ef",
    "pixelSize": {
      "width": 160,
      "height": 96
    }
  },
  "projectionPolicy": {
    "roleSource": "explicit_semantic_declaration",
    "textSource": "bound_ocr_observation",
    "evidenceTriangle": "truth_ocr_truth_region_association",
    "cardinality": "exactly_one",
    "ambiguityDisposition": "fail_closed"
  },
  "egressPolicy": {
    "allowCloud": false
  },
  "requestedAt": "2026-07-29T08:03:00Z"
}
